{
  "pair_id": "asymmetric_qualifier_034",
  "bucket": "asymmetric_qualifiers",
  "expected_decision": "fork",
  "source": "synthetic",
  "claim_a": {
    "claim_type": "engagement",
    "field_path": "usage.trend",
    "object": {
      "kind": "literal",
      "literal_kind": "enum",
      "value": "seasonal_spike"
    },
    "polarity": "affirm",
    "predicate": "product_usage_trend",
    "qualifiers": {
      "entity": null,
      "extras": {},
      "numerics": [],
      "region": null,
      "scope": null,
      "time": null
    },
    "sensitivity": "internal",
    "sentiment": "neutral",
    "status": "confirmed",
    "subject_ref": {
      "id": "meeting_007",
      "kind": "meeting"
    },
    "text": "Weekly active users have dropped 18 percent over the last quarter.",
    "workspace_id": "workspace_alpha"
  },
  "claim_b": {
    "claim_type": "engagement",
    "field_path": "usage.trend",
    "object": {
      "kind": "literal",
      "literal_kind": "enum",
      "value": "seasonal_spike"
    },
    "polarity": "affirm",
    "predicate": "product_usage_trend",
    "qualifiers": {
      "entity": null,
      "extras": {},
      "numerics": [],
      "region": {
        "code": "EU"
      },
      "scope": null,
      "time": null
    },
    "sensitivity": "internal",
    "sentiment": "neutral",
    "status": "confirmed",
    "subject_ref": {
      "id": "meeting_007",
      "kind": "meeting"
    },
    "text": "Weekly active users have dropped 18 percent over the last quarter.",
    "workspace_id": "workspace_alpha"
  },
  "rationale": "One side carries an additional qualifier — must fork rather than merge."
}