{
  "pair_id": "positive_paraphrase_137",
  "bucket": "positive_paraphrases",
  "expected_decision": "merge",
  "source": "synthetic",
  "claim_a": {
    "claim_type": "risk",
    "field_path": "renewal.risk",
    "object": {
      "kind": "literal",
      "literal_kind": "enum",
      "value": "high"
    },
    "polarity": "affirm",
    "predicate": "account_renewal_risk",
    "qualifiers": {
      "entity": null,
      "extras": {},
      "numerics": [],
      "region": null,
      "scope": null,
      "time": null
    },
    "sensitivity": "internal",
    "sentiment": "neutral",
    "status": "confirmed",
    "subject_ref": {
      "id": "person_028",
      "kind": "person"
    },
    "text": "Renewal is in jeopardy after the latest incident.",
    "workspace_id": "workspace_alpha"
  },
  "claim_b": {
    "claim_type": "risk",
    "field_path": "renewal.risk",
    "object": {
      "kind": "literal",
      "literal_kind": "enum",
      "value": "high"
    },
    "polarity": "affirm",
    "predicate": "account_renewal_risk",
    "qualifiers": {
      "entity": null,
      "extras": {},
      "numerics": [],
      "region": null,
      "scope": null,
      "time": null
    },
    "sensitivity": "internal",
    "sentiment": "neutral",
    "status": "confirmed",
    "subject_ref": {
      "id": "person_028",
      "kind": "person"
    },
    "text": "Following the incident, renewal is at significant risk.",
    "workspace_id": "workspace_alpha"
  },
  "rationale": "Same subject, predicate, polarity, object, qualifiers, and status; text varies only by paraphrase."
}