{
  "pair_id": "positive_paraphrase_012",
  "bucket": "positive_paraphrases",
  "expected_decision": "merge",
  "source": "synthetic",
  "claim_a": {
    "claim_type": "stakeholder_role",
    "field_path": "role.classification",
    "object": {
      "kind": "literal",
      "literal_kind": "enum",
      "value": "influencer"
    },
    "polarity": "affirm",
    "predicate": "stakeholder_role",
    "qualifiers": {
      "entity": null,
      "extras": {},
      "numerics": [],
      "region": null,
      "scope": null,
      "time": null
    },
    "sensitivity": "internal",
    "sentiment": "neutral",
    "status": "confirmed",
    "subject_ref": {
      "id": "person_003",
      "kind": "person"
    },
    "text": "She influences the buying committee but does not own it.",
    "workspace_id": "workspace_alpha"
  },
  "claim_b": {
    "claim_type": "stakeholder_role",
    "field_path": "role.classification",
    "object": {
      "kind": "literal",
      "literal_kind": "enum",
      "value": "influencer"
    },
    "polarity": "affirm",
    "predicate": "stakeholder_role",
    "qualifiers": {
      "entity": null,
      "extras": {},
      "numerics": [],
      "region": null,
      "scope": null,
      "time": null
    },
    "sensitivity": "internal",
    "sentiment": "neutral",
    "status": "confirmed",
    "subject_ref": {
      "id": "person_003",
      "kind": "person"
    },
    "text": "She sways the committee without holding the decision.",
    "workspace_id": "workspace_alpha"
  },
  "rationale": "Same subject, predicate, polarity, object, qualifiers, and status; text varies only by paraphrase."
}