{
  "pair_id": "positive_paraphrase_101",
  "bucket": "positive_paraphrases",
  "expected_decision": "merge",
  "source": "synthetic",
  "claim_a": {
    "claim_type": "risk",
    "field_path": "renewal.risk",
    "object": {
      "kind": "literal",
      "literal_kind": "enum",
      "value": "low"
    },
    "polarity": "affirm",
    "predicate": "account_renewal_risk",
    "qualifiers": {
      "entity": null,
      "extras": {},
      "numerics": [],
      "region": null,
      "scope": {
        "normalized": "phase_2"
      },
      "time": null
    },
    "sensitivity": "internal",
    "sentiment": "neutral",
    "status": "confirmed",
    "subject_ref": {
      "id": "account_021",
      "kind": "account"
    },
    "text": "The renewal conversation is back on track.",
    "workspace_id": "workspace_alpha"
  },
  "claim_b": {
    "claim_type": "risk",
    "field_path": "renewal.risk",
    "object": {
      "kind": "literal",
      "literal_kind": "enum",
      "value": "low"
    },
    "polarity": "affirm",
    "predicate": "account_renewal_risk",
    "qualifiers": {
      "entity": null,
      "extras": {},
      "numerics": [],
      "region": null,
      "scope": {
        "normalized": "phase_2"
      },
      "time": null
    },
    "sensitivity": "internal",
    "sentiment": "neutral",
    "status": "confirmed",
    "subject_ref": {
      "id": "account_021",
      "kind": "account"
    },
    "text": "Renewal momentum has recovered.",
    "workspace_id": "workspace_alpha"
  },
  "rationale": "Same subject, predicate, polarity, object, qualifiers, and status; text varies only by paraphrase."
}