{
  "pair_id": "low_trust_duplicate_001",
  "bucket": "low_trust_duplicates",
  "expected_decision": "ambiguous",
  "source": "synthetic",
  "claim_a": {
    "claim_type": "risk",
    "field_path": "approval.status",
    "non_semantic_mergeable": true,
    "object": {
      "kind": "literal",
      "literal_kind": "enum",
      "value": "pending_finance_approval"
    },
    "polarity": "affirm",
    "predicate": "contract_approval_status",
    "qualifiers": {
      "entity": null,
      "extras": {},
      "numerics": [],
      "region": null,
      "scope": {
        "normalized": "phase_1"
      },
      "time": null
    },
    "sensitivity": "internal",
    "sentiment": "neutral",
    "status": "confirmed",
    "subject_ref": {
      "id": "account_0",
      "kind": "account"
    },
    "text": "Phase 2 budget approval is pending with finance.",
    "workspace_id": "workspace_alpha"
  },
  "claim_b": {
    "claim_type": "risk",
    "field_path": "approval.status",
    "non_semantic_mergeable": true,
    "object": {
      "kind": "literal",
      "literal_kind": "enum",
      "value": "pending_finance_approval"
    },
    "polarity": "affirm",
    "predicate": "contract_approval_status",
    "qualifiers": {
      "entity": null,
      "extras": {},
      "numerics": [],
      "region": null,
      "scope": {
        "normalized": "phase_1"
      },
      "time": null
    },
    "sensitivity": "internal",
    "sentiment": "neutral",
    "status": "confirmed",
    "subject_ref": {
      "id": "account_0",
      "kind": "account"
    },
    "text": "Phase 2 budget approval is pending with finance.",
    "workspace_id": "workspace_alpha"
  },
  "rationale": "Structurally identical claims with weak corroboration — route to needs_verification, not auto-merge."
}