{
  "pair_id": "positive_paraphrase_018",
  "bucket": "positive_paraphrases",
  "expected_decision": "merge",
  "source": "synthetic",
  "claim_a": {
    "claim_type": "engagement_topic",
    "field_path": "topic.mentioned",
    "object": {
      "canonical": "support_quality",
      "kind": "free_text"
    },
    "polarity": "affirm",
    "predicate": "topic_mentioned",
    "qualifiers": {
      "entity": null,
      "extras": {},
      "numerics": [],
      "region": null,
      "scope": null,
      "time": null
    },
    "sensitivity": "internal",
    "sentiment": "neutral",
    "status": "confirmed",
    "subject_ref": {
      "id": "account_17",
      "kind": "account"
    },
    "text": "Support quality concerns dominated the meeting.",
    "workspace_id": "workspace_alpha"
  },
  "claim_b": {
    "claim_type": "engagement_topic",
    "field_path": "topic.mentioned",
    "object": {
      "canonical": "support_quality",
      "kind": "free_text"
    },
    "polarity": "affirm",
    "predicate": "topic_mentioned",
    "qualifiers": {
      "entity": null,
      "extras": {},
      "numerics": [],
      "region": null,
      "scope": null,
      "time": null
    },
    "sensitivity": "internal",
    "sentiment": "neutral",
    "status": "confirmed",
    "subject_ref": {
      "id": "account_17",
      "kind": "account"
    },
    "text": "The meeting was dominated by complaints about support.",
    "workspace_id": "workspace_alpha"
  },
  "rationale": "Same subject, predicate, polarity, object, qualifiers, and status; text varies only by paraphrase."
}