{
  "pair_id": "positive_paraphrase_188",
  "bucket": "positive_paraphrases",
  "expected_decision": "merge",
  "source": "synthetic",
  "claim_a": {
    "claim_type": "engagement",
    "field_path": "usage.trend",
    "object": {
      "kind": "literal",
      "literal_kind": "enum",
      "value": "seasonal_spike"
    },
    "polarity": "affirm",
    "predicate": "product_usage_trend",
    "qualifiers": {
      "entity": null,
      "extras": {},
      "numerics": [],
      "region": null,
      "scope": null,
      "time": null
    },
    "sensitivity": "internal",
    "sentiment": "neutral",
    "status": "confirmed",
    "subject_ref": {
      "id": "account_187",
      "kind": "account"
    },
    "text": "Engagement is flat with no movement either direction.",
    "workspace_id": "workspace_alpha"
  },
  "claim_b": {
    "claim_type": "engagement",
    "field_path": "usage.trend",
    "object": {
      "kind": "literal",
      "literal_kind": "enum",
      "value": "seasonal_spike"
    },
    "polarity": "affirm",
    "predicate": "product_usage_trend",
    "qualifiers": {
      "entity": null,
      "extras": {},
      "numerics": [],
      "region": null,
      "scope": null,
      "time": null
    },
    "sensitivity": "internal",
    "sentiment": "neutral",
    "status": "confirmed",
    "subject_ref": {
      "id": "account_187",
      "kind": "account"
    },
    "text": "Usage has plateaued — no growth, no decline.",
    "workspace_id": "workspace_alpha"
  },
  "rationale": "Same subject, predicate, polarity, object, qualifiers, and status; text varies only by paraphrase."
}