{
  "pair_id": "contradiction_016",
  "bucket": "contradictions",
  "expected_decision": "contradict",
  "source": "synthetic",
  "claim_a": {
    "claim_type": "stakeholder_role",
    "field_path": "role.classification",
    "object": {
      "kind": "literal",
      "literal_kind": "enum",
      "value": "decision_maker"
    },
    "polarity": "affirm",
    "predicate": "stakeholder_role",
    "qualifiers": {
      "entity": null,
      "extras": {},
      "numerics": [],
      "region": null,
      "scope": {
        "normalized": "phase_1"
      },
      "time": null
    },
    "sensitivity": "internal",
    "sentiment": "neutral",
    "status": "confirmed",
    "subject_ref": {
      "id": "account_15",
      "kind": "account"
    },
    "text": "He is the champion for the integration project.",
    "workspace_id": "workspace_alpha"
  },
  "claim_b": {
    "claim_type": "stakeholder_role",
    "field_path": "role.classification",
    "object": {
      "kind": "literal",
      "literal_kind": "enum",
      "value": "decision_maker"
    },
    "polarity": "negate",
    "predicate": "stakeholder_role",
    "qualifiers": {
      "entity": null,
      "extras": {},
      "numerics": [],
      "region": null,
      "scope": {
        "normalized": "phase_1"
      },
      "time": null
    },
    "sensitivity": "internal",
    "sentiment": "neutral",
    "status": "confirmed",
    "subject_ref": {
      "id": "account_15",
      "kind": "account"
    },
    "text": "He is not the champion for the integration project.",
    "workspace_id": "workspace_alpha"
  },
  "rationale": "Same subject, predicate, qualifiers, and object — opposite polarity."
}