{
  "pair_id": "positive_paraphrase_152",
  "bucket": "positive_paraphrases",
  "expected_decision": "merge",
  "source": "synthetic",
  "claim_a": {
    "claim_type": "engagement",
    "field_path": "usage.trend",
    "object": {
      "kind": "literal",
      "literal_kind": "enum",
      "value": "flat"
    },
    "polarity": "affirm",
    "predicate": "product_usage_trend",
    "qualifiers": {
      "entity": null,
      "extras": {},
      "numerics": [],
      "region": null,
      "scope": null,
      "time": null
    },
    "sensitivity": "internal",
    "sentiment": "neutral",
    "status": "confirmed",
    "subject_ref": {
      "id": "account_151",
      "kind": "account"
    },
    "text": "Weekly active users have dropped 18 percent over the last quarter.",
    "workspace_id": "workspace_alpha"
  },
  "claim_b": {
    "claim_type": "engagement",
    "field_path": "usage.trend",
    "object": {
      "kind": "literal",
      "literal_kind": "enum",
      "value": "flat"
    },
    "polarity": "affirm",
    "predicate": "product_usage_trend",
    "qualifiers": {
      "entity": null,
      "extras": {},
      "numerics": [],
      "region": null,
      "scope": null,
      "time": null
    },
    "sensitivity": "internal",
    "sentiment": "neutral",
    "status": "confirmed",
    "subject_ref": {
      "id": "account_151",
      "kind": "account"
    },
    "text": "Weekly actives are down roughly a fifth quarter over quarter.",
    "workspace_id": "workspace_alpha"
  },
  "rationale": "Same subject, predicate, polarity, object, qualifiers, and status; text varies only by paraphrase."
}