{
  "pair_id": "positive_paraphrase_083",
  "bucket": "positive_paraphrases",
  "expected_decision": "merge",
  "source": "synthetic",
  "claim_a": {
    "claim_type": "risk",
    "field_path": "renewal.risk",
    "object": {
      "kind": "literal",
      "literal_kind": "enum",
      "value": "at_risk"
    },
    "polarity": "affirm",
    "predicate": "account_renewal_risk",
    "qualifiers": {
      "entity": null,
      "extras": {},
      "numerics": [],
      "region": null,
      "scope": null,
      "time": null
    },
    "sensitivity": "internal",
    "sentiment": "neutral",
    "status": "confirmed",
    "subject_ref": {
      "id": "project_017",
      "kind": "project"
    },
    "text": "Renewal probability looks weak this cycle.",
    "workspace_id": "workspace_alpha"
  },
  "claim_b": {
    "claim_type": "risk",
    "field_path": "renewal.risk",
    "object": {
      "kind": "literal",
      "literal_kind": "enum",
      "value": "at_risk"
    },
    "polarity": "affirm",
    "predicate": "account_renewal_risk",
    "qualifiers": {
      "entity": null,
      "extras": {},
      "numerics": [],
      "region": null,
      "scope": null,
      "time": null
    },
    "sensitivity": "internal",
    "sentiment": "neutral",
    "status": "confirmed",
    "subject_ref": {
      "id": "project_017",
      "kind": "project"
    },
    "text": "Renewal looks unlikely this cycle.",
    "workspace_id": "workspace_alpha"
  },
  "rationale": "Same subject, predicate, polarity, object, qualifiers, and status; text varies only by paraphrase."
}