{
  "pair_id": "contradiction_018",
  "bucket": "contradictions",
  "expected_decision": "contradict",
  "source": "synthetic",
  "claim_a": {
    "claim_type": "stakeholder_role",
    "field_path": "role.classification",
    "object": {
      "kind": "literal",
      "literal_kind": "enum",
      "value": "end_user"
    },
    "polarity": "affirm",
    "predicate": "stakeholder_role",
    "qualifiers": {
      "entity": null,
      "extras": {},
      "numerics": [],
      "region": null,
      "scope": null,
      "time": null
    },
    "sensitivity": "internal",
    "sentiment": "neutral",
    "status": "confirmed",
    "subject_ref": {
      "id": "project_004",
      "kind": "project"
    },
    "text": "The stakeholder role is end user.",
    "workspace_id": "workspace_alpha"
  },
  "claim_b": {
    "claim_type": "stakeholder_role",
    "field_path": "role.classification",
    "object": {
      "kind": "literal",
      "literal_kind": "enum",
      "value": "champion"
    },
    "polarity": "affirm",
    "predicate": "stakeholder_role",
    "qualifiers": {
      "entity": null,
      "extras": {},
      "numerics": [],
      "region": null,
      "scope": null,
      "time": null
    },
    "sensitivity": "internal",
    "sentiment": "neutral",
    "status": "confirmed",
    "subject_ref": {
      "id": "project_004",
      "kind": "project"
    },
    "text": "The stakeholder role is champion.",
    "workspace_id": "workspace_alpha"
  },
  "rationale": "Same subject, predicate, qualifiers, and polarity with different object values — contradiction."
}