{
  "pair_id": "contradiction_041",
  "bucket": "contradictions",
  "expected_decision": "contradict",
  "source": "synthetic",
  "claim_a": {
    "claim_type": "risk",
    "field_path": "risk.status",
    "object": {
      "kind": "literal",
      "literal_kind": "enum",
      "value": "escalated"
    },
    "polarity": "affirm",
    "predicate": "risk_status",
    "qualifiers": {
      "entity": null,
      "extras": {},
      "numerics": [],
      "region": null,
      "scope": {
        "normalized": "phase_2"
      },
      "time": null
    },
    "sensitivity": "internal",
    "sentiment": "neutral",
    "status": "confirmed",
    "subject_ref": {
      "id": "account_40",
      "kind": "account"
    },
    "text": "The risk is open.",
    "workspace_id": "workspace_alpha"
  },
  "claim_b": {
    "claim_type": "risk",
    "field_path": "risk.status",
    "object": {
      "kind": "literal",
      "literal_kind": "enum",
      "value": "escalated"
    },
    "polarity": "negate",
    "predicate": "risk_status",
    "qualifiers": {
      "entity": null,
      "extras": {},
      "numerics": [],
      "region": null,
      "scope": {
        "normalized": "phase_2"
      },
      "time": null
    },
    "sensitivity": "internal",
    "sentiment": "neutral",
    "status": "confirmed",
    "subject_ref": {
      "id": "account_40",
      "kind": "account"
    },
    "text": "The risk is not open.",
    "workspace_id": "workspace_alpha"
  },
  "rationale": "Same subject, predicate, qualifiers, and object — opposite polarity."
}