{
  "pair_id": "contradiction_049",
  "bucket": "contradictions",
  "expected_decision": "contradict",
  "source": "synthetic",
  "claim_a": {
    "claim_type": "risk",
    "field_path": "approval.status",
    "object": {
      "kind": "literal",
      "literal_kind": "enum",
      "value": "pending_security_review"
    },
    "polarity": "affirm",
    "predicate": "contract_approval_status",
    "qualifiers": {
      "entity": null,
      "extras": {},
      "numerics": [],
      "region": null,
      "scope": null,
      "time": null
    },
    "sensitivity": "internal",
    "sentiment": "neutral",
    "status": "confirmed",
    "subject_ref": {
      "id": "account_48",
      "kind": "account"
    },
    "text": "The contract has been approved.",
    "workspace_id": "workspace_alpha"
  },
  "claim_b": {
    "claim_type": "risk",
    "field_path": "approval.status",
    "object": {
      "kind": "literal",
      "literal_kind": "enum",
      "value": "pending_security_review"
    },
    "polarity": "negate",
    "predicate": "contract_approval_status",
    "qualifiers": {
      "entity": null,
      "extras": {},
      "numerics": [],
      "region": null,
      "scope": null,
      "time": null
    },
    "sensitivity": "internal",
    "sentiment": "neutral",
    "status": "confirmed",
    "subject_ref": {
      "id": "account_48",
      "kind": "account"
    },
    "text": "The contract has not been approved.",
    "workspace_id": "workspace_alpha"
  },
  "rationale": "Same subject, predicate, qualifiers, and object — opposite polarity."
}