{
  "pair_id": "positive_paraphrase_108",
  "bucket": "positive_paraphrases",
  "expected_decision": "merge",
  "source": "synthetic",
  "claim_a": {
    "claim_type": "stakeholder_role",
    "field_path": "role.classification",
    "object": {
      "kind": "literal",
      "literal_kind": "enum",
      "value": "end_user"
    },
    "polarity": "affirm",
    "predicate": "stakeholder_role",
    "qualifiers": {
      "entity": null,
      "extras": {},
      "numerics": [],
      "region": null,
      "scope": null,
      "time": null
    },
    "sensitivity": "internal",
    "sentiment": "neutral",
    "status": "confirmed",
    "subject_ref": {
      "id": "project_022",
      "kind": "project"
    },
    "text": "He uses the product daily as an end user.",
    "workspace_id": "workspace_alpha"
  },
  "claim_b": {
    "claim_type": "stakeholder_role",
    "field_path": "role.classification",
    "object": {
      "kind": "literal",
      "literal_kind": "enum",
      "value": "end_user"
    },
    "polarity": "affirm",
    "predicate": "stakeholder_role",
    "qualifiers": {
      "entity": null,
      "extras": {},
      "numerics": [],
      "region": null,
      "scope": null,
      "time": null
    },
    "sensitivity": "internal",
    "sentiment": "neutral",
    "status": "confirmed",
    "subject_ref": {
      "id": "project_022",
      "kind": "project"
    },
    "text": "Daily product usage from him as an end user is consistent.",
    "workspace_id": "workspace_alpha"
  },
  "rationale": "Same subject, predicate, polarity, object, qualifiers, and status; text varies only by paraphrase."
}